{
  "body_topology": [
    {
      "body": "BridgePlate",
      "edges": [
        {
          "end": [
            0.0,
            70.0,
            29.99999999999999
          ],
          "index": 0,
          "length": 70.0,
          "mid": [
            0.0,
            35.0,
            29.99999999999999
          ],
          "name": "F1:+z|F1:-x",
          "start": [
            0.0,
            0.0,
            29.99999999999999
          ]
        },
        {
          "end": [
            0.0,
            70.0,
            0.0
          ],
          "index": 1,
          "length": 29.99999999999999,
          "mid": [
            0.0,
            70.0,
            14.999999999999996
          ],
          "name": "F1:+y|F1:-x",
          "start": [
            0.0,
            70.0,
            29.99999999999999
          ]
        },
        {
          "end": [
            0.0,
            0.0,
            0.0
          ],
          "index": 2,
          "length": 70.0,
          "mid": [
            0.0,
            35.0,
            0.0
          ],
          "name": "F1:-x|F1:-z",
          "start": [
            0.0,
            70.0,
            0.0
          ]
        },
        {
          "end": [
            0.0,
            0.0,
            29.99999999999999
          ],
          "index": 3,
          "length": 29.99999999999999,
          "mid": [
            0.0,
            0.0,
            14.999999999999996
          ],
          "name": "F1:-x|F1:-y",
          "start": [
            0.0,
            0.0,
            0.0
          ]
        },
        {
          "end": [
            -1.7763568394002493e-15,
            53.27170291851906,
            12.698704709744147
          ],
          "index": 4,
          "length": 12.476366036677751,
          "mid": [
            -1.0987195780670008e-16,
            47.69870470974375,
            11.728297081480507
          ],
          "name": "F1:-x|F5:bore:side:1",
          "start": [
            2.220446049250312e-16,
            46.72829708148102,
            17.30129529025598
          ]
        },
        {
          "end": [
            2.220446049250325e-16,
            46.72829708148102,
            17.30129529025598
          ],
          "index": 5,
          "length": 12.476366036677428,
          "mid": [
            1.201328591214317e-16,
            52.30129529025623,
            18.271702918519484
          ],
          "name": "F1:-x|F5:bore:side:0",
          "start": [
            -1.7763568394002505e-15,
            53.27170291851907,
            12.698704709744147
          ]
        },
        {
          "end": [
            100.0,
            70.0,
            29.99999999999999
          ],
          "index": 6,
          "length": 100.0,
          "mid": [
            50.0,
            70.0,
            29.99999999999999
          ],
          "name": "F1:+y|F1:+z",
          "start": [
            0.0,
            70.0,
            29.99999999999999
          ]
        },
        {
          "end": [
            100.0,
            70.0,
            0.0
          ],
          "index": 7,
          "length": 29.99999999999999,
          "mid": [
            100.0,
            70.0,
            14.999999999999996
          ],
          "name": "F1:+x|F1:+y",
          "start": [
            100.0,
            70.0,
            29.99999999999999
          ]
        },
        {
          "end": [
            0.0,
            70.0,
            0.0
          ],
          "index": 8,
          "length": 100.0,
          "mid": [
            50.0,
            70.0,
            0.0
          ],
          "name": "F1:+y|F1:-z",
          "start": [
            100.0,
            70.0,
            0.0
          ]
        },
        {
          "end": [
            100.0,
            0.0,
            29.99999999999999
          ],
          "index": 9,
          "length": 70.0,
          "mid": [
            100.0,
            35.0,
            29.99999999999999
          ],
          "name": "F1:+x|F1:+z",
          "start": [
            100.0,
            70.0,
            29.99999999999999
          ]
        },
        {
          "end": [
            100.0,
            0.0,
            0.0
          ],
          "index": 10,
          "length": 29.99999999999999,
          "mid": [
            100.0,
            0.0,
            14.999999999999996
          ],
          "name": "F1:+x|F1:-y",
          "start": [
            100.0,
            0.0,
            29.99999999999999
          ]
        },
        {
          "end": [
            100.0,
            70.0,
            0.0
          ],
          "index": 11,
          "length": 70.0,
          "mid": [
            100.0,
            35.0,
            0.0
          ],
          "name": "F1:+x|F1:-z",
          "start": [
            100.0,
            0.0,
            0.0
          ]
        },
        {
          "end": [
            0.0,
            0.0,
            29.99999999999999
          ],
          "index": 12,
          "length": 100.0,
          "mid": [
            50.0,
            0.0,
            29.99999999999999
          ],
          "name": "F1:+z|F1:-y",
          "start": [
            100.0,
            0.0,
            29.99999999999999
          ]
        },
        {
          "end": [
            100.0,
            0.0,
            0.0
          ],
          "index": 13,
          "length": 100.0,
          "mid": [
            50.0,
            0.0,
            0.0
          ],
          "name": "F1:-y|F1:-z",
          "start": [
            0.0,
            0.0,
            0.0
          ]
        },
        {
          "end": [
            22.45377718888929,
            21.7259714676919,
            29.99999999999999
          ],
          "index": 14,
          "length": 9.308326186461937,
          "mid": [
            21.72597146769189,
            17.546222811110695,
            29.99999999999999
          ],
          "name": "F1:+z|F2:bore:side:1",
          "start": [
            17.546222811110685,
            18.27402853230809,
            29.99999999999999
          ]
        },
        {
          "end": [
            22.45377718888929,
            21.725971467691902,
            0.0
          ],
          "index": 15,
          "length": 29.99999999999999,
          "mid": [
            22.45377718888929,
            21.725971467691902,
            14.999999999999996
          ],
          "name": "F2:bore:side:0|F2:bore:side:1~2",
          "start": [
            22.45377718888929,
            21.725971467691902,
            29.99999999999999
          ]
        },
        {
          "end": [
            17.546222811110685,
            18.274028532308098,
            0.0
          ],
          "index": 16,
          "length": 9.308326186461944,
          "mid": [
            21.72597146769189,
            17.546222811110695,
            0.0
          ],
          "name": "F1:-z|F2:bore:side:1",
          "start": [
            22.45377718888929,
            21.725971467691902,
            0.0
          ]
        },
        {
          "end": [
            17.546222811110685,
            18.27402853230809,
            29.99999999999999
          ],
          "index": 17,
          "length": 29.99999999999999,
          "mid": [
            17.546222811110685,
            18.27402853230809,
            14.999999999999996
          ],
          "name": "F2:bore:side:0|F2:bore:side:1~1",
          "start": [
            17.546222811110685,
            18.27402853230809,
            0.0
          ]
        },
        {
          "end": [
            17.546222811110685,
            18.274028532308098,
            29.99999999999999
          ],
          "index": 18,
          "length": 9.308326186461914,
          "mid": [
            18.274028532308098,
            22.453777188889283,
            29.999999999999982
          ],
          "name": "F1:+z|F2:bore:side:0",
          "start": [
            22.45377718888929,
            21.725971467691902,
            29.99999999999999
          ]
        },
        {
          "end": [
            22.45377718888929,
            21.725971467691902,
            0.0
          ],
          "index": 19,
          "length": 9.308326186461915,
          "mid": [
            18.27402853230809,
            22.453777188889283,
            0.0
          ],
          "name": "F1:-z|F2:bore:side:0",
          "start": [
            17.546222811110685,
            18.27402853230809,
            0.0
          ]
        },
        {
          "end": [
            49.08962864814885,
            22.876619112819835,
            29.99999999999999
          ],
          "index": 20,
          "length": 15.595457545845631,
          "mid": [
            47.87661911281982,
            15.910371351851168,
            29.99999999999999
          ],
          "name": "F1:+z|F3:bore:side:1",
          "start": [
            40.91037135185114,
            17.12338088718014,
            29.99999999999999
          ]
        },
        {
          "end": [
            49.08962864814885,
            22.876619112819835,
            18.0
          ],
          "index": 21,
          "length": 11.99999999999999,
          "mid": [
            49.08962864814885,
            22.876619112819835,
            23.999999999999993
          ],
          "name": "F3:bore:side:0|F3:bore:side:1~2",
          "start": [
            49.08962864814885,
            22.876619112819835,
            29.99999999999999
          ]
        },
        {
          "end": [
            40.91037135185114,
            17.12338088718014,
            18.0
          ],
          "index": 22,
          "length": 15.595457545845624,
          "mid": [
            47.87661911281981,
            15.910371351851172,
            18.0
          ],
          "name": "F3:bore:base|F3:bore:side:1",
          "start": [